{
    "$schema": "https://json-schema.org/draft/2020-12/schema",
    "title": "Diba Fasl Schema",
    "version": "1.0",
    "type": "object",
    "properties": {
        "number": {
            "type": "integer",
            "minimum": 1,
            "description": "The chapter number."
        },
        "source": {
            "type": "string",
            "description": "The source of the text."
        },
        "name": {
            "type": "string",
            "description": "The Arabic name of the fasl (chapter)."
        },
        "latin": {
            "type": [
                "string",
                "null"
            ],
            "description": "The transliteration of the chapter name."
        },
        "sections": {
            "type": "object",
            "patternProperties": {
                "^[0-9]+$": {
                    "type": "object",
                    "properties": {
                        "name": {
                            "type": "string"
                        },
                        "type": {
                            "type": "string",
                            "enum": [
                                "rawi",
                                "bari",
                                "closing"
                            ]
                        },
                        "text": {
                            "type": "object",
                            "patternProperties": {
                                "^[0-9]+$": {
                                    "type": "object",
                                    "properties": {
                                        "arabic": {
                                            "type": "string",
                                            "description": "The Arabic text of the verse."
                                        },
                                        "latin": {
                                            "type": [
                                                "string",
                                                "null"
                                            ],
                                            "description": "The transliteration of the Arabic text."
                                        }
                                    },
                                    "required": [
                                        "arabic"
                                    ]
                                }
                            },
                            "additionalProperties": false
                        }
                    },
                    "required": [
                        "type",
                        "text"
                    ],
                    "additionalProperties": false
                }
            },
            "additionalProperties": false
        },
        "translations": {
            "type": "object",
            "description": "Translations in various languages.",
            "patternProperties": {
                "^[a-z]{2}$": {
                    "type": "object",
                    "properties": {
                        "name": {
                            "type": "string"
                        },
                        "muqaddimah": {
                            "type": "string",
                            "description": "(introduction) of the chapter."
                        },
                        "translator": {
                            "type": "string",
                            "description": "translator of the chapter."
                        },
                        "sections": {
                            "type": "object",
                            "patternProperties": {
                                "^[0-9]+$": {
                                    "type": "object",
                                    "properties": {
                                        "text": {
                                            "type": "object",
                                            "patternProperties": {
                                                "^[0-9]+$": {
                                                    "type": "string"
                                                }
                                            },
                                            "additionalProperties": false
                                        }
                                    },
                                    "required": [
                                        "text"
                                    ],
                                    "additionalProperties": false
                                }
                            },
                            "additionalProperties": false
                        }
                    },
                    "required": [
                        "sections"
                    ],
                    "additionalProperties": false
                }
            },
            "additionalProperties": false
        },
        "last_updated": {
            "type": "string",
            "format": "date",
            "pattern": "^(\\d{4})-(\\d{2})-(\\d{2})$",
            "description": "The date when the data was last updated, in ISO 8601 date format (e.g., '2024-11-09')."
        }
    },
    "required": [
        "number",
        "source",
        "name",
        "last_updated"
    ],
    "anyOf": [
        {
            "required": [
                "sections"
            ]
        },
        {
            "required": [
                "translations"
            ]
        }
    ],
    "additionalProperties": false
}