{
    "number": 9,
    "source": "nu-online",
    "name": "",
    "latin": "Shalâtullâhi ma laḫat…",
    "sections": {
        "1": {
            "name": "",
            "type": "bari",
            "text": {
                "1": {
                    "arabic": "صَــــلَاةُ اللهِ مَـــا لَاحَتْ كَوَاكِبْ ۞ عَلَى احْمَدْ خَيْرِ مَنْ رَّكِبَ النَّجَآئِبْ",
                    "latin": "Shalâtullâhi mâ lâḫat kawâkib ۞ ‘ala aḫmad khairi man rakiban-najâ’ib"
                },
                "2": {
                    "arabic": "حَدٰى حَادِى السُّرٰى بِاسْمِ الْحَبَائِبْ ۞ فَهَـــــزَّ الشُّكْرُ أَعْطَافَ الرَّكَائِبْ",
                    "latin": "ḫadâ hâdis-surâ bismil-ḫabâ’ib ۞ fahazzasy-syukru a‘thâfur-rakâ’ib"
                },
                "3": {
                    "arabic": "أَلَمْ تَرَهَا وَقَدْ مَدَّتْ حُـــطَاهَـــا ۞ وَسَالَتْ مِنْ مَّدَامِعِـــهَا سَحَـــآئِبْ",
                    "latin": "Alam tarahâ wa qad madat ḫuthâhâ ۞ wa sâlat min madâmi‘ihâ saḫâ’ib"
                },
                "4": {
                    "arabic": "وَمَالَتْ لِلْـــحِمٰى طَرَبًا وَحَنَّتْ ۞ إِلَى تِلْكَ الْمَعَالِمِ وَالْمَــــلَاعِبْ",
                    "latin": "Wa mâ lilḫimâ tharaban wa ḫannat ۞ ilâ tilkal-ma‘âlimi wal-malâ‘ib"
                },
                "5": {
                    "arabic": "فَدَعْ جَذْبَ الزِّمَامِ وَلَا تَسُـقْهَا ۞ فَقَائِدُ شَوقِهَا لِلْــــحَيِّ جَـــاذِبْ",
                    "latin": "Fada‘ jadzbaz-zimâmi wa lâ tasuqhâ ۞ faqâ’idu syauqihâ lil-ḫayyi jâdzib"
                },
                "6": {
                    "arabic": "فَهِمْ طَــــرَبًا كَمَا هَــــامَتْ وَإِلَّا ۞ فَإِنَّكَ فِي طَـــرِيقِ الْحُـبِّ كَاذِبْ",
                    "latin": "Fahim tharaban kamâ hamat wa illâ ۞ fa innaka fî tharîqil-ḫubbi kâdzib"
                },
                "7": {
                    "arabic": "أَمَّا هٰذَا الْعَقِيْــــقُ بَدَا وَهٰذِيْ ۞ قِبَابُ الْحَيِّ لَاحَتْ وَالْمَــضَارِبْ",
                    "latin": "Ammâ hâdzal-‘aqîqu badâ wa hâdzî ۞ qibâbul-ḫayyi lâḫat wal-madlârib"
                },
                "8": {
                    "arabic": "وَتِلْكَ الْقُبَّــــةُ الْخَــضْرَا وَفِيْهَــــا ۞ نَبِيٌّ نُوْرُهٗ يَجْـــلُوْ الْغَـــيَاهِبْ",
                    "latin": "Wa tilkal-qubbatul-khadlrâ wa fîhâ ۞nabiyyun nûruhu yajlul-ghayâhib"
                },
                "9": {
                    "arabic": "وَقَـدْ صَحَّ الرِّضَى وَدَنَا التَّلَاقِي ۞ وَقَدْ جَاءَ الْهَنَا مِنْ كُلِّ جَــــانِبْ",
                    "latin": "Wa qad shaḫḫar-ridlâ wa danat-talâqî ۞ wa qad jâ’al-hanâ min kulli jânib"
                },
                "10": {
                    "arabic": "فَقُلْ لِّلنَّفْسِ دُوْنَكِ وَالتَّمَــلِّى ۞ فَمَا دُوْنَ الْحَبِيْبِ الْيَوْمَ حَــــاجِبْ",
                    "latin": "Faqul linnafsi dûnaki wat-tamallî ۞ famâ dûnal-ḫabîbil-yauma ḫâjib"
                },
                "11": {
                    "arabic": "تَمَلَّى بِـــالْحَبِيْبِ بِكُلِّ قَصْـــــدٍ ۞ فَقَدْ حَصَلَ الْهَنَا وَالضِـــدُّ غَائِبْ",
                    "latin": "Tamallâ bil-ḫabîbi bikulli qashdin ۞ faqad hashalal-hanâ wadl-dliddu ghâ’ib"
                },
                "12": {
                    "arabic": "نَبِيُّ اللهِ خَــــيْرُ الْخَلْقِ جَمْـعًـــــا ۞ لَهٗ أَعْلَى الْمَنَاصِبِ وَالْمَـــرَاتِبْ",
                    "latin": "Nabiyyullâhi Khairul-khalqi jam‘a ۞ lahu a‘lal-manâshibi wal-marâtib"
                },
                "13": {
                    "arabic": "لَهُ الْجَاهُ الرَّفِيْــــعُ لَهُ الْمَعَـــالِي ۞ لَهُ الشَّرَفُ الْمُؤَبَّدُ وَالْمَنَـــاقِبْ",
                    "latin": "Lahul-jâhur-râfi‘u lahul-ma‘âlî ۞ lahusy-syaraful-mu’abbadu wal-manâqib"
                },
                "14": {
                    "arabic": "فَـــلَوْ أَنَّـــــا سَعَيْنَــا كُلَّ يَومٍ ۞ عَلَى الْأَحْدَاقِ لَا فَوْقَ النَّجَــــائِبْ",
                    "latin": "Falau annâ sa‘ainâ kulla yaumin ۞ ‘alal-aḫdâqi lâ fauqan-najâ’ib"
                },
                "15": {
                    "arabic": "وَلَوْ أَنَّــا عَمِلْنَــــا كُلَّ حِــــيْنٍ ۞ لِأَحْمَـــدَ مَوْلِدًا قَــدْ كَانَ وَاجِبْ",
                    "latin": "Wa lau annâ ‘amilnâ kulla ḫînin ۞ li aḫmada maulidin qad kâna wâjib"
                },
                "16": {
                    "arabic": "عَلَيْهِ مِنَ الْمُهَيْمِنِ كُلَّ وَقْتٍ ۞ صَلَاةٌ مَّا بَدَا نُورُ الْكَواكِبْ",
                    "latin": "‘alaihi minal-muhaimini kulla waqtin ۞ shalâtun mâ badâ nûrul-kawâkib"
                },
                "17": {
                    "arabic": "تَعُـــمُّ الْاٰلَ وَالْأَصْحَـابَ طُرًّا ۞ جَمِيعَهُــــــمْ وَعِتْرَتَـــــهُ الْأَطَايِبْ",
                    "latin": "Ta‘ummul-âla wal-ashḫâba thurran ۞ jamî‘ahum wa ‘itratahul-athâyib"
                }
            }
        },
        "2": {
            "name": "",
            "type": "closing",
            "text": {
                "1": {
                    "arabic": "اَللّٰهُمَّ صَلِّ وَسَلِّمْ وَبَارِكْ عَلَيْهِ",
                    "latin": "Allâhumma shalli wa sallim wa bârik 'alaihi wa 'alâ âlihi"
                }
            }
        }
    },
    "translations": {
        "id": {
            "name": "",
            "sections": {
                "1": {
                    "text": {
                        "1": "Selagi cahaya bintang masih gemerlapan, semoga rahmat Allah tercurah. Kepada Nabi Muhammad, Sang pengendara unta terbaik",
                        "2": "Pengiring unta berdendang menyanyikan lagu menyebut nama kekasih. Sementara untanya mengangguk-angguk menari gembira mengikuti irama lagu penunggangnya",
                        "3": "Tidakkah engkau lihat, semakin cepat langkah unta? Bercucuran deras dari matanya air mata bagaikan awan tiba.",
                        "4": "Semakin condong langkahnya karena kegembiraan dan rindu Menuju kandang dan ladang penggembalaannya.",
                        "5": "Biarkan, jangan kau Tarik tali kekang dan jangan menggiringnya. Karena kerinduan pada sang nabilah yang akan menariknya.",
                        "6": "Tunjukkanlah rasa cintamu sebagaimana cintanya unta dan jikalau tidak, Maka jalan cintamu pada nabi adalah dusta.",
                        "7": "Perhatikan, kota Aqiq telah nampak dan inilah Kubah-kubah penduduk, gemerlapan cahayanya menyilaukan",
                        "8": "Dan itulah kubah hijau dan di dalamnya, Terdapar seorang Nabi yang nur-nya menerangi kegelapan.",
                        "9": "Dan sungguh jelas keridhaan Allah seiring pertemuan yang semakin dekat Dan sungguh telah datang kegembiraan dari segala penjuru.",
                        "10": "Maka bisikkan ke dalam hati, “temui sang kekasih dan bergembiralah”. Maka hari ini tiada satupun yang menjadi penghalang kepada kekasih",
                        "11": "Condongkanlah rasa cinta kepada kekasih di segala tujuan, Maka pastilah akan datang suka dan lenyaplah duka.",
                        "12": "Nabi Allah adalah sebaik-baiknya seluruh makhluk. Baginya keluhuran pangkat dan martabat tertinggi.",
                        "13": "Baginya kedudukan yang tinggi serta segala keluhuran. Kemuliaannya diabadikan dan menjadi kenangan.",
                        "14": "Maka seandainya kami menuju tempat, berjalan setiap saat Di atas pandangan, bukan di punggung-punggung unta.",
                        "15": "Dan seandainya kami beramal setiap hari Pada peringatan kelahiran Ahmad, maka sungguh hukumnya wajib.",
                        "16": "Setiap waktu kumohonkan untuknya dari Allah. Rahmat selama bintang-bintang masih bercahaya.",
                        "17": "Yang merata kepada keluarga dan para sahabat semuanya. Serta semua keturunannya yang baik-baik lagi mulia."
                    }
                },
                "2": {
                    "text": {
                        "1": "Ya Allah, limpahkan rahmat, kesalamatan, serta keberkahan kepada Nabi Muhammad beserta keluarga beliau"
                    }
                }
            }
        }
    },
    "last_updated": "2024-12-14"
}