{
    "number": 29,
    "source": "nu-online",
    "name": "",
    "latin": "Doa Maulid ad-Diba’i",
    "sections": {
        "1": {
            "name": "",
            "type": "rawi",
            "text": {
                "1": {
                    "arabic": "اَلْحَمْدُ لِلّٰهِ رَبِّ الْعَـــالَمِيْنَ. اَللّٰهُمَّ صَلِّ وَسَلِّمْ عَلٰى سَيِّدِنَا مُحَمَّدٍ وَعَلَى اٰلِهٖ وَصَحْبِهٖ أَجْمَعِيْن. جَعَلَنَا اللهُ وَإِيَاكُمْ مِمَّنْ يَسْتَوْجِبُ شَفَاعَتَهُ. وَيَرْجُوْ بِذٰلِكَ رَحْمَتَهُ وَرَأْفَتَهُ. اَللّٰهُمَّ بِحُرْمَةِ هٰذَا النَّبِيِّ الْكَرِيْمِ. وَاٰلِهِ وَأَصْحَابِهِ السَّالِكِيْنَ عَلَى مَنْهَجِهِ الْقَوِيْمِ. اِجْعَلْنَا مِنْ خِيَارِ أُمَّتِهٖ. وَاسْتُرْنَا بِذَيْلِ حُرْمَتِهِ. وَاحْشُـرْنَا غَدًا فِيْ زُمْرَتِهِ. وَاسْتَعْمِلْ أَلْسِنَتَنَا فِيْ مَدْحِهٖ وَنُصْـرَتِهِ. وَأَحْيِنَا مُتَمَسِّكِيْنَ بِسُنَّتِهِ وَطَاعَتِهِ. وَأَمِتْنَا عَلَى حُبِّهٖ وَجَمَاعَتِهِ. اَللّٰهُمَّ أَدْخِلْنَا مَعَهُ الْجَنَّةَ فَإِنَّهُ أَوَّلُ مَنْ يَدْخُلُهَا. وَأَنْزِلْنَا مَعَهٗ فِيْ قُصُوْرِهَا. فَإِنَّهُ أَوَّلُ مَنْ يَنْزِلُهَا. وَارْحَمْنَا يَوْمَ يَشْفَعُ لِلْخَلَآئِقِ فَتَرْحَمُهَا. اَللّٰهُمَّ ارْزُقْنَا زِيَارَتَهٗ فِيْ كُلِّ سَنَةٍ. وَلَا تَجْعَلْنَا مِنَ الْغَافِلِيْنَ عَنْكَ وَلَا عَنْهُ قَدْرَ سِنَةٍ. اَللّٰهُمَّ لَا تَجْعَلْ فِيْ مَجْلِسِنَا هٰذَا أَحَدًا إِلَّا غَسَلْتَ بِمَاءِ التَّوْبَةِ ذُنُوْبَهُ. وَسَتَرْتَ بِرِدَآءِ الْمَغْفِرَةِ عُيُوْبَهُ. اَللّٰهُمَّ إِنَّهٗ كَانَ مَعَنَا فِي السَّنَةِ الْمَاضِيَةِ إِخْوَانٌ مَنَعَهُمُ الْقَضَآءُ عَنِ الْوُصُوْلِ إِلَى مِثْلِهَا. فَلَا تَحْرِمْهُمْ مِنْ ثَوَابِ هٰذِهِ اللَّيْلَةِ وَفَضْلِهَا. اَللّٰهُمَّ ارْحَمْنَا إِذَا صِرْنَا مِنْ أَصْحَابِ الْقُبُوْرِ. وَوَفِّقْنَا لِعَمَلٍ صَالِحٍ يَبْقٰى سَنَاهُ عَلَى مَمَرِّ الدُّهُوْرِ. اَللّٰهُمَّ اجْعَلْنَا لِاٰلَآئِكَ ذَاكِرِيْنَ. وَلِنَعْمَآئِكَ شَاكِرِيْنَ. وَلِيَوْمِ لِقَآئِكَ مِنَ الذَّاكِرِيْنَ. وَأَحْيِنَا بِطَاعَتِكَ مَشْغُوْلِيْنَ. وَإِذَا تَوَفَّيْتَنَا فَتَوَفَّنَا غَيْرَ مَفْتُوْنِيْنَ وَلَا مَخْذُوْلِيْنَ. وَٱخْتِمْ لَنَا مِنْكَ بِخَيْرٍ أَجْمَعِيْنَ. اَللّٰهُمَّ اكْفِنَا شَرَّ الظَّالِمِيْنَ. وَاجْعَلْنَا مِنْ فِتْنَةِ هٰذِهِ الدُّنْيَا سَالِمِيْنَ. اَللّٰهُمَّ اجْعَلْ هٰذَا الرَّسُوْلَ الْكَرِيْمَ لَنَا شَفِيْعًا. وَارْزُقْنَا بِهِ يَوْمَ الْقِيَامَةِ مَقَامًا رَفِيْعًا. اَللّٰهُمَّ اسْقِنَا مِنْ حَوْضِ نَبِيِّكَ مُحَمَّدٍ صَلَّى اللهُ عَلَيْهِ وَسَلَّمَ شَرْبَةً هَنِيْئَةً لَا نَظْمَأُ بَعْدَهَا أَبَدًا. وَاحْشُــرْنَا تَحْتَ لِوَآئِهِ غَدًا. اَللّٰهُمَّ اغْفِرْ لَنَا بِهٖ وَلِاٰبـَآئِنَا وَلِأُمَّهَاتِنَا وَلِمَشَايِخِنَا وَلِمُعَلِّمِيْنَا. وَذَوِي الْحُقُوْقِ عَلَيْنَا. وَلِجَمِيْعِ الْمُؤْمِنِيْنَ وَالْمُؤْمِنَاتِ. وَالْمُسْلِمِيْنَ وَالْمُسْلِمَاتِ. اَلْأَحْيَآءِ مِنْهُمْ وَالْأَمْوَاتِ. إِنَّكَ كَرِيْمٌ مُجِيْبُ الدَّعَوَاتِ. وَقَاضِي الْحَاجَاتِ. وَغَافِرُ الذُّنُوْبِ وَالْخَطِيْئَاتِ. يَا أَرْحَمَ الرَّاحِمِيْنَ. وَصَلَّى اللهُ عَلَى سَيِّدِنَا مُحَمَّدٍ وَعَلَى اٰلِهِ وَصَحْبِهٖ وَسَلَّمَ. سُبْحَانَ رَبِّــكَ رَبِّ الْعِزَّةِ عَمَّا يَصِفُوْنَ. وَسَلَامٌ عَلَى الْمُرْسَلِيْنَ. وَالْحَمْدُ ِللّٰهِ رَبِّ الْعَالَمِيْنَ. اَلْفَاتِحَة",
                    "latin": "Al-ḫamdulillâhi rabbil-‘âlamîn, allâhumma shalli ‘alâ sayyidinâ muḫammadin wa ‘alâ âlihî wa shaḫbihi ajma‘îna, ja‘alanâllâhu wa iyâkum mimman yastaujibu syafâ’atahu, wa yarjû bidzâlika raḫmatahu wa ra’fatahu, allâḫumma biḫurmati hâdzan-nabiyyil-karîmi, wa âlihi wa ashḫâbihis-sâlikîna ‘alâ manhajihil-qawîmi, ij‘alnâ min khiyâri ummatihi, wasturnâ bidzaili ḫurmatihi, waḫsyurnâ ghadan fî zumratihi, wasta‘mil alsinatanâ fî madḫihi wa nushratihi, wa aḫyinâ mutamassikîna bisunnatihi wathâ‘atihi, wa amitnâ ‘alâ ḫubbihi wa jamâ‘atihi, allâḫumma adkhilnâ ma‘ahul-jannata fainnahu awwalu man yadkhuluhâ, wa anzilnâ ma‘ahu fî qushûrihâ, fainnahu awwalu man yanziluhâ, warḫamnâ yauma yasyfa‘u lil-khalâ’iqi fatarḫamuhâ, allâḫummar-zuqnâ ziyâratahu fî kulli sanatin, walâ taj‘alnâ minal-ghâfilîna anka wa lâ ‘anhu qadra sinatin, allâḫumma lâ taj‘aln fî majlisinâ hâdzâ aḫadan illâ ghasalta bimâ’it-taubati dzunûbahu, wa satarta biridâ’il-maghfirati ‘uyûbahu, allâḫumma innahu kâna ma‘anâ fis-sanatil-mâdliyati, ikhwânun mana‘ahumul-qadlâ’u ‘anil-wushûli ilâ mitslihâ, falâ taḫrimhum min tsawâbi hâdzihil-lailati wafadllihâ, allâḫummarḫamnâ idzâ shirnâ min ashḫâbil-qubûri, wawaffiqnâ li‘amailshâliḫi yabqâ sanâhu ‘alâ mamarrid-duhûri, allâḫumj‘alnâ li’âlâ’ika dzâkirîn, wa lina‘mâ’ika syâkirîna, wa liyaumi liqâ’ika minadz-dzâkirîna, waḫyinâ bithâ‘atika masyghûlina, wa idzâ tawaffaitanâ fatawaffanâ ghaira maftûnîna, wa lâ makhdzûlîna, wakhtim lanâ minka bikhairi ajma‘îna, allâḫummakfinâ syarradh-dhâlimîn, waj‘alnâ min fitnati hâdzihid-dunyâ sâlimîn, allâḫuj‘al hâdzar-rasûlal-karîma lanâ syafî‘an, warzuqnâ bihi yaumal-qiyâmati maqâman rafî‘an, allâhummas-qinâ min ḫaudli nabiyyika muḫammadin shallallâhu ‘alaihi wa sallama syarbatan hanî’atan lâ nadhma’a ba‘dahâ abadan, waḫsyurnâ taḫta liwâ’ihi ghadzan, allâḫummaghfir lanâ bihî wa li’abâ’inâ wa li’ummahâtinâ wa limasyâyikhinâ wa limu‘alliminâ, wa dzawil-ḫuqûqi ‘alaina, wa lijamî‘il-mu’minîna wal-mu’minât, wal-muslimîna wal-muslimâti, al-aḫyâ’i minhum wal-amwâti, innaka karîmun mujîbud-da‘awâti, wa qâdliyal-ḫâjâti, wa ghâfirudz-dzunûbi wal-khathî’âti, yâ arḫamar-raḫimîna, wa shallallâḫu ‘alâ sayyidinâ muḫammadin wa ‘alâ âlihi wa shaḫbihi wa sallam, subḫânaka rabbika rabbil-‘izzati ‘ammâ yashifûna, wa salâmun ‘alal-mursalîna, wal-ḫamdulillâhi rabbil-‘âlamîna, al-fâtiḫah."
                }
            }
        },
        "2": {
            "name": "",
            "type": "closing",
            "text": {
                "1": {
                    "arabic": "اَللّٰهُمَّ صَلِّ وَسَلِّمْ وَبَارِكْ عَلَيْهِ",
                    "latin": "Allâhumma shalli wa sallim wa bârik 'alaihi wa 'alâ âlihi"
                }
            }
        }
    },
    "translations": {
        "id": {
            "name": "",
            "sections": {
                "1": {
                    "text": {
                        "1": "Segala puji bagi Allah Tuhan seru sekelian alam. Ya Allah limpahkanlah rahmat dan salam atas Junjungan kami Nabi Muhammad dan atas keluarga serta sahabatnya sekalian. semoga Allah menjadikan kami dan kamu sekalian dari golongan orang yang mendapat syafaatnya; Serta mengharapkan rahmat dan kasih sayangnya dari Allah. Ya Allah dengan kehormatan Nabi yang mulia ini dan keluarga serta sahabatnya yang berjalan atas petunjuk Nabi yang kokoh. Jadikanlah kami termasuk umatnya yang terpilih. Tutuplah segala kekurangan kami. Himpunkanlah kami kelak (Hari Mahsyar) didalam golongannya. Pergunakanlah lidah-lidah kami dalam memuji dan membelanya. Hidupkanlah kami dalam keadaan berpegang dengan sunnahnya dan ketaatannya, dari segala fitnah dunia. Ya Allah jadikanlah Rasul yang mulia ini orang yang memberi syafaat kepada kami. Matikanlah kami dalam kecintaan kepadanya dan dalam jemaahnya. Ya Allah masukkanlah kami kedalam syurga bersama-samanya kerana baginda orang yang mula-mula masuk ke dalamnya. Turunkanlah kami dalam mahligainya bersama-samanya kerana bagindalah orang yang mula turun kedalamnya. Kasihanilah kami dihari dia memberi syafaat kepada makhlok lalu engkau kasihani mereka. Ya Allah berilah kami peluang menziarahinya setiap tahun. Janganlah Engkau jadikan kami dari golongan orang yang lalai dari mengingatiMu dan juga lalai dari mengingatinya walau sekejap kadar terlelap. Ya Allah janganlah hendaknya ada di majlis kami ini orang yang berdosa melainkan Engkau cuci segala dosanya dengan air taubat; dan Engkau tutupi keaibannya dengan pakaian pengampunan. Ya Allah pada tahun yang lalu ada ikhwan kami yang tidak dapat menghadirkan diri pada tahun ini kerana dihalang oleh QadhaMu, maka janganlah Engkau haramkan pahala serta ganjaran yang Engkau turunkan pada saat ini. Ya Allah kasihanilah kami jika kami sudah menjadi ahlilkubur. Berilah kami Taufiq untuk membuat amal salih yang kekal cahayanya sepanjang zaman. Ya Allah jadikanlah kami orang yang ingat kepada pemberianMu, bersyukur atas nikmatMu, dan ingat kepada Hari Pertemuan denganMu. Hidupkanlah kami masyghul dengan ketaatan kepadaMu. Kiranya Engkau matikan kami. Matikanlah kami tanpa sebarang fitnah atau kekeciwaan. Sudahilah segala perkara kami dengan kebaikan daripadaMu. Ya Allah selamatkanlah kami dari kejahatan orang yang aniaya (3 kali) . Jadikanlah kami orang yang terselamat dari fitnah Dunia, dan kurniakanlah kami dengan sebabnya kedudukan yang tinggi diHari Qiamat kelak. Ya Allah berilah kami minum dari telaga Nabi Mu Muhammad ﷺ dengan minuman yang melegakan menyebabkan kami tidak rasa haus lagi selepasnya. Himpunkanlah kami di bawah panji-panjinya esok (Hari Mahsyar). Ya Allah dengan darjatnya disisiMu, ampunilah kami, kedua ibu bapa kami, guru-guru kami, orang-orang yang punya haq atas kami, serta sekalian mukminin mukminat, muslimin muslimat samada yang masih hidup mahu pun yang sudah wafat. Sesungguhnya Engkau memperkenankan segala doa, menunaikan segala hajat dan mengampuni segala dosa dan kesalahan. Ya Tuhan yang amat Pengasih dari semua yang kasih. Selawat dan salam Allah atas penghulu kami Muhammad dan atas keluarga serta sahabatnya. Mahasuci Tuhanmu yang mempunyai kemuliaan dari segala apa yang mereka sifatkan.Ucapan salam atas sekalian Rasul dan segala puji bagi Allah Tuhan seru sekalian alam. Al-Fatihah"
                    }
                },
                "2": {
                    "text": {
                        "1": "Ya Allah, limpahkan rahmat, kesalamatan, serta keberkahan kepada Nabi Muhammad beserta keluarga beliau"
                    }
                }
            }
        }
    },
    "last_updated": "2024-12-14"
}