{
    "number": 12,
    "source": "nu-online",
    "name": "",
    "latin": "Fanasya-a shallallâhu…",
    "sections": {
        "1": {
            "name": "",
            "type": "rawi",
            "text": {
                "1": {
                    "arabic": "فَنَشَأَ صَلَّى اللهُ عَلَيْهِ وَسَلَّمَ عَلَى أَكْمَلِ الْأَوْصَاف. يَحُفُّهُ مِنَ اللهِ جَمِيْلُ الرِّعَايَةِ وَغَامِرُ الْأَلْطَاف. فَكَانَ يَشِبُّ فِي الْيَوْمِ شَبَابَ الصَّبِيِّ فيِ الشَّهْرِ. وَيَظْهَرُ عَلَيْهِ فِي صِبَاهُ مِنْ شَرَفِ الْكَمَالِ مَا يَشْهَدُ لَهُ بِأَنَّهُ سَيِّدُ وَلَدِ آدَمَ وَلَا فَخْر. وَلَمْ يَزَلْ وَأَنْجُمُ سُعُوْدِهِ طَالِعَة. وَالْكَائِنَاتُ لِعَهْدِهِ حَافِظَةٌ وَلِأَمْرِهِ طَائِعَة. فَمَا نَفَثَ عَلَى مَرِيْضٍ إِلَّا شَفَاهُ الله. وَلَاتَوَجَّهَ فِي غَيْثٍ إِلَّا وَأَنْزَلَهُ مَوْلَاه. حَتَّى بَلَغَ مِنَ الْعُمْرِ أَشُدَّه. وَمَضَتْ لَهُ مِنْ سِنِّ الشَّبَابِ وَالْكُهُوْلَةِ مُدَّة. فَاجَأَتْهُ الْحَضْرَةُ الْاِلٰـهِيَّةُ بِمَا شَرَّفَتْهُ بِهِ وَحْدَه. فَنَزَلَ عَلَيْهِ الرُّوْحُ الْأَمِيْن. بِالْبُشْرَى مِنْ رَبِّ الْعَالَمِيْن. فَتَلَا عَلَيْهِ لِسَانُ الذِّكْرِ الْحَكِيْمِ شَاهِدَ ﴿وَاِنَّكَ لَتُلَقَّى الْقُرْآنَ مِنْ لَدُنْ حَكِيْمٍ عَلِيْمٍ﴾ فَكَانَ أَوَّلَ مَا نَزَلَ عَلَيْهِ مِنْ تِلْكَ الْحَضْرَةِ مِنْ جَوَامِعِ الْحِكَم. قَوْلُهُ تَعَالَى : ﴿اِقْرَأ بِاسْمِ رَبِّكَ الَّذِيْ خَلَقَ. خَلَقَ الْإِنْسَانَ مِنْ عَلَقَ. اِقْرَأْ وَرَبُّكَ الْأَكْرَمُ. اَلَّذِيْ عَلَّمَ بِالْقَلَمِ. عَلَّمَ الْإِنْسَانَ مَا لَمْ يَعْلَم﴾ فَمَا أَعْظَمَهَا مِنْ بِشَارَةٍ أَوْصَلَتْهَا يَدُ الْإِحْسَان. مِنْ حَضْرَةِ الْاِمْتِنَان. إِلَى هٰذَا الْإِنْسَان. وَأَيَّدَتْهَا بِشَارَةُ ﴿اَلرَّحْمَنُ عَلَّمَ الْقُرْآنَ. خَلَقَ الْاِنْسَانَ عَلَّمَهُ الْبَيَانَ﴾ وَلَاشَكَّ أَنَّهُ صَلَّى اللهُ عَلَيْهِ وَسَلَّمَ هُوَ الْإِنْسَانُ الْمَقْصُوْدُ بِهٰذَا التَّعْلِيْم. مِنْ حَضْرَةِالرَّحْمٰنِ الرَّحِيْم",
                    "latin": "Fanasyâ’a shallallâhu ‘alaihi wa sallama ‘alâ akmalil-aushâfi, yaḫuffuhu minallâhi jamîlur-ri‘âyati wa ghâmirul-althâfi, fakâna yasyibbu fil-yaumi syabâbash-shabiyyi fisy-syahri, wa yadhharu ‘alaihi fî shibâhu min syarafil-kamâli mâ yasyhadu lahu bi annahu sayyidu waladi âdama wa lâ fakhr. Wa lam yazal wa anjumu su‘ûdihi thâli‘ah, wal-kâ’inâtu li‘ahdihi ḫafidhatun wa liamrihi thâ‘iah, famâ nafatsa ‘alâ marîdlin illâ syafâhullâhu, wa lâ tawajjaha fî ghaitsin illâ wa anzalahu maulâhu, ḫattâ balagha minal-‘umri asyuddahu, wa madlat lahu min sinnisy-syabâbi wal-kuhûlati muddati, faja’at hul-ḫadlratul-ilâhiyyatu bimâ syarrafat hu bihi waḫdahu, fanazala ‘alaihir-rûhul-amîn, bil-busyrâ min rabbil-‘âlamîna, fatalâ ‘alaihi lisânudz-dzikril-ḫakîmi syâhid ﴾wa innaka latulaqqâl-qur’âna min ladun ḫakîmin ‘alîm ﴿ fakâna awwala mâ nazala ‘alaihi min tilkal-ḫadlrati min jawâmi‘il-ḫikam. qauluhu ta‘âlâ: ﴾iqra bismi rabbiklal-ladzî khalaqa, khalaqal-insâna min ‘alaq, iqra wa rabbukal-akram, alladzî ‘allama bil-qalam, ‘allamal-insâna mâ lam ya‘lam﴿, famâ a‘dhamahâ min bisyâratin aushalat hâ yadul-iḫsân, min ḫadlratil-imtinân, ilâ hâdzal-insân, wa ayyadat hâ bisyâratu ﴾ar-raḫmanu ‘allamal-qur’âna, khalaqal-insâna ‘allamahul-bayâna﴿ wa lâ syakka annahu shallallâhu ‘alaihi wa sallama huwal-insânul-maqshûdu bihâdzat-ta‘lim, min ḫadlratir-raḫmânir-raḫîm."
                }
            }
        },
        "2": {
            "name": "",
            "type": "closing",
            "text": {
                "1": {
                    "arabic": "﴿اَللّٰهُمَّ صَلِّ وَسَلِّمْ أَشْرَفَ الصَّلَاةِ وَالتَّسْلِيْمِ عَلَى سَيِّدِنَا وَنَبِيِّنَا مُحَمَّدٍ ࣙالرَّؤُوْفِ الرَّحِيْمِ﴾"
                }
            }
        }
    },
    "translations": {
        "id": {
            "name": "",
            "sections": {
                "1": {
                    "text": {
                        "1": "Rasulullah ﷺ tumbuh dengan sifat-sifat paling sempurna, dikelilingi selalu pemeliharaan Allah Maha Kuasa serta diliputi rahmat-Nya berlimpah-limpah. la tumbuh dalam sehari , seperti bayi lain dalam sebulan. Keluhuran pribadinya tampak sempurna sejak usianya yang amat muda menjadi saksi bahwa dialah penghulu keturunan Adam semuanya. Bintang-bintang kemujuran selalu bersamanya. Demikian pula segenap benda di alam ini menampakkan kesetiaan dan kepatuhan padanya. Tiap kali ia “meniupi” penderita sakit, niscaya Allah melimpahkan kesembuhan baginya. Tiap kali berdoa memohon hujan, niscaya Allah selalu menurunkannya. Demikian keadaannya sehari-hari, sampai ia telah melewati masa mudanya dan mencapai usia dewasa, saat itulah Allah mengkhususkannya, dengan kemuliaan hanya baginya seorang. Dan turunlah Jibril Ar-Ruhul Amin membawa kabar gembira dari Tuhan Seru Sekalian Alam, membacakan baginya ayat-ayat suci Al Quran Al-Hakim, “,…Dan sesungguhnya kepadamu telah diberikan Al-Qur’an dari hadirat Allah, yang Maha Bijaksana lagi Maha Mengetahui.” Adapun mula pertama diturunkan kepadanya, di antara ayat-ayat suci padat berisi, yang berasal dari hadirat Allah SWT ialah, “Bacalah dengan nama Tuhanmu, Yang mencipta manusia dari segumpal darah. Bacalah! Tuhanmulah yang paling mulia, Yang mengajar dengan kalam, mengajar manusia apa yang tidak ia tahu.” Oh… betapa agungnya kabar gembira ini! Karunia sempurna datang dari Allah Maha Pengasih lagi Maha pemurah ditujukan kepada insan mulia ini. Lalu dikuatkan lagi dengan firman-Nya, “Ar-Rahman, Tuhan Maha Pemurah, mengajarkan Al-Qur’an, mencipta insan, lalu diajarinya fasih perkataan…” Dan tiada syak lagi tentunya beliaulah insan yang dimaksud dengan pemberian ajaran itu darl hadirat Allah, yang Maha Rahman dan Rahim."
                    }
                },
                "2": {
                    "text": {
                        "1": "Limpahkan, ya Allah, semulia-mulia shalawat dan salam atas junjungan dan nabi kami, Muhammad SAW yang amat penyantun dan penyayang"
                    }
                }
            }
        }
    },
    "last_updated": "2024-11-16"
}